{
  "schema_version": 3,
  "plan_id": "v10-master-draft-20261009",
  "video": {
    "width": 1920,
    "height": 1080,
    "fps": 30
  },
  "shots_manifest": {
    "path": "assets/productions/v10-master-draft-20261009/shots-manifest.json",
    "sha256": "bf8a9ec8b63683f9bebacc5c51dbbce9dd9521420c1839b4824adc58d571956c"
  },
  "chapters": [
    {
      "path": "assets/productions/v10-master-draft-20261009/s01-chapter.json",
      "sha256": "0f1beb881273d6b262db479b9c95d1a17e35b3bf4dfb7a42cfd8b82276796dbf"
    },
    {
      "path": "assets/productions/v10-master-draft-20261009/s02-chapter.json",
      "sha256": "2fc8391b7409c92194927bff7b427736ad47ff4f0de98bf42260cd53042970c7"
    },
    {
      "path": "assets/productions/v10-master-draft-20261009/s03-chapter.json",
      "sha256": "9eb52a911ab238bd6b7541c9e8d36ff6eb72d45836f5bbef1c98e03946af7380"
    },
    {
      "path": "assets/productions/v10-master-draft-20261009/s04-chapter.json",
      "sha256": "8cf965b5f338d253b0e09b7e45e95d6b8455311d6e068a32f7eae39e10605730"
    },
    {
      "path": "assets/productions/v10-master-draft-20261009/s05-chapter.json",
      "sha256": "199bbbc29430a78fbaf7905f42e560f90466a1550c47ddb02efe909a4b7db114"
    },
    {
      "path": "assets/productions/v10-master-draft-20261009/s06-chapter.json",
      "sha256": "14207f55f8adfad252e39582905f7d2bedc0bb90079a73eb3dd09c2c8dda43c3"
    },
    {
      "path": "assets/productions/v10-master-draft-20261009/s07-chapter.json",
      "sha256": "789deec872949a9a5c96c6a12a727829cdda7da6630acfdef038fbb8c5d37621"
    },
    {
      "path": "assets/productions/v10-master-draft-20261009/credits-chapter.json",
      "sha256": "79524f1f6b4b6b86d6864a022755491be135a2ffdfa158c5575830a64fcc8e7e"
    }
  ],
  "film": {
    "audio": {
      "path": "assets/audio/full-film-v10-continuous-48000-stereo.flac",
      "sha256": "156c48e45f30da16fa123d764a8df235fbe84af06444e29f5b0ec80bac5fe641",
      "sample_rate": 48000,
      "channels": 2,
      "decoded_pcm_sha256": "06e1fbb75c9c253aca7bb6fdc7fe29cebafab5d9225a557fac38978622c94963"
    },
    "outputs": {
      "clean": "assets/renders/v10-master-draft-{film_id}-clean.mp4",
      "subtitles": "assets/renders/v10-master-draft-{film_id}-subtitles.mp4"
    }
  },
  "notes": "v10 draft migration example, not film quality acceptance; imported pilot visuals need independent replay manifests for recast."
}
